{
  "schema": "worker-result.operator/1",
  "ssot_id": "e2e-read-04c9d864d719",
  "task_id": "e2e-read_only",
  "slice_id": "op-01",
  "role": "operator",
  "status": "done",
  "summary": "Validated schema + fixtures and found no forbidden role references.",
  "evidence": {
    "commands": [
      {
        "cmd": "python3 dev/multi-agent/e2e/run_smoke.py",
        "cwd": "/Users/xavier/code/trusted/x/hack-ink/skills",
        "exit_code": 0,
        "stdout_excerpt": "OK: e2e fixtures + invariants"
      }
    ],
    "files_read": ["multi-agent/PLAYBOOK.md"]
  },
  "next_actions": ["Proceed with write slices."]
}

